{
  "$schema": "https://schemas.linxin666.org/dsh-skin/v2.json",
  "skinManifestVersion": 2,
  "id": "blue-fantasy",
  "name": "蓝色幻想",
  "nameEn": "Blue Fantasy",
  "author": "powerdog996（DreamSkin 社区）· dsh-web 适配",
  "tagline": "鲸鱼插画背景 · periwinkle 靛蓝调色板 · 半透明面板",
  "description": "DreamSkin「DeepSeek-鲸鱼娘」Codex 桌面主题的 dsh 适配：鲸鱼插画背景垫在半透明面板之下，遮罩随亮/暗主题实时切换，periwinkle 靛蓝色调重映射到全部 dsh token。",
  "tags": [
    "dreamskin",
    "whale",
    "indigo",
    "art",
    "translucent"
  ],
  "accent": "#4a5fa8",
  "order": 2,
  "version": "0.2.0",
  "preview": {
    "light": "preview/light.jpg",
    "dark": "preview/dark.jpg"
  },
  "requires": {
    "contracts": [
      {
        "apiVersion": "x-org.linxin666.skin-center/v1alpha1",
        "kind": "SkinHooks",
        "optional": true
      }
    ]
  },
  "contributes": {
    "stylesheet": "skin.css",
    "patches": "patches.css",
    "backgroundMedia": {
      "light": {
        "type": "image",
        "src": "assets/whale-art.jpg",
        "scrim": "linear-gradient(rgba(246, 248, 253, 0.08) 0%, rgba(240, 243, 251, 0.14) 55%, rgba(235, 239, 249, 0.2) 100%)"
      },
      "dark": {
        "type": "image",
        "src": "assets/whale-art.jpg",
        "scrim": "linear-gradient(rgba(10, 14, 28, 0.35) 0%, rgba(13, 18, 34, 0.45) 60%, rgba(16, 22, 42, 0.5) 100%)"
      }
    }
  },
  "facets": {
    "client": {
      "entry": "hooks.mjs",
      "apiVersion": "x-org.linxin666.skin-center/v1alpha1"
    }
  }
}
