{
  "$schema": "https://schemas.linxin666.org/dsh-skin/v2.json",
  "skinManifestVersion": 2,
  "id": "furina",
  "name": "芙宁娜",
  "nameEn": "Furina",
  "author": "sclass53",
  "tagline": "芙宁娜背景 · 淡蓝主题 · 半透明面板",
  "description": "基于原神角色芙宁娜的dsh-web-ui主题",
  "tags": [
    "blue",
    "Furina",
    "translucent",
    "anime"
  ],
  "accent": "#4a5fb5",
  "order": 67,
  "version": "0.1.20",
  "preview": {
    "light": "preview/light.png",
    "dark": "preview/dark.png"
  },
  "requires": {
    "contracts": [
      {
        "apiVersion": "x-org.linxin666.skin-center/v1alpha1",
        "kind": "SkinHooks",
        "optional": true
      }
    ]
  },
  "contributes": {
    "stylesheet": "skin.css",
    "patches": "patches.css",
    "backgroundMedia": {
      "light": {
        "type": "image",
        "src": "assets/furina-art.jpg",
        "scrim": "linear-gradient(rgba(246, 248, 253, 0.08) 0%, rgba(240, 243, 251, 0.08) 55%, rgba(235, 239, 249, 0.08) 100%)"
      },
      "dark": {
        "type": "image",
        "src": "assets/furina-art.jpg",
        "scrim": "linear-gradient(rgba(10, 14, 28, 0.1) 0%, rgba(13, 18, 34, 0.1) 60%, rgba(16, 22, 42, 0.1) 100%)"
      }
    }
  },
  "facets": {
    "client": {
      "entry": "hooks.mjs",
      "apiVersion": "x-org.linxin666.skin-center/v1alpha1"
    }
  }
}
