{
  "$schema": "https://schemas.linxin666.org/dsh-skin/v2.json",
  "skinManifestVersion": 2,
  "id": "observatory",
  "name": "天文台",
  "nameEn": "Observatory",
  "version": "1.0.0",
  "author": "stushansusu",
  "tagline": "午夜靛 · 老黄铜 · 穹顶肋缝 · 时辰刻度",
  "description": "山顶天文台的观测室：黄铜仪器、午夜靛的天。不是「工程蓝图」那套制图——那是青线网格；这套是圆、弧、刻度、铆钉，全是线，没有一处面积填充。中性层是午夜靛，只带色温不带彩度；老黄铜是全场唯一有彩度的东西，只走线、走字、走点睛。母题是观测室本身：穹顶的纬度环与扇形肋缝、底部的十二时辰刻度带、一排黄铜铆钉，加上首屏的观测环（方位刻度／赤经赤纬读数／十字丝）、星等标尺与水准泡。红只留给需要你看一眼的信号灯。",
  "tags": [
    "observatory",
    "brass",
    "midnight",
    "dome",
    "reticle",
    "instrument",
    "scale",
    "precise",
    "css-only",
    "dark-only"
  ],
  "accent": "#c2a55a",
  "order": 27,
  "preview": {
    "light": "preview/light.jpg",
    "dark": "preview/dark.jpg"
  },
  "contributes": {
    "stylesheet": "skin.css",
    "patches": "patches.css",
    "backgroundMedia": {
      "light": {
        "type": "image",
        "src": "assets/observatory-bg.webp",
        "scrim": "linear-gradient(180deg, rgba(8,10,16,0.40) 0%, rgba(8,10,16,0.48) 45%, rgba(8,10,16,0.64) 100%)"
      },
      "dark": {
        "type": "image",
        "src": "assets/observatory-bg.webp",
        "scrim": "linear-gradient(180deg, rgba(8,10,16,0.40) 0%, rgba(8,10,16,0.48) 45%, rgba(8,10,16,0.64) 100%)"
      }
    }
  }
}
