{
  "$schema": "https://schemas.linxin666.org/dsh-skin/v2.json",
  "skinManifestVersion": 2,
  "id": "wallpaper-exclusive",
  "name": "壁纸专属",
  "nameEn": "Wallpaper Exclusive",
  "version": "0.2.2",
  "author": "chemmy-11",
  "tagline": "壁纸优先 · 液态玻璃面板",
  "description": "作者 chemmy-11。默认背景为深海鲸语女神 v2，壁纸从面板背后透出，不画自己的背景；气泡 / 代码块 / 任务清单 / 插件面板及命令、权限、模型、上下文四看板展开层为液态玻璃，气泡模糊强度由皮肤中心滑杆驱动；排队消息以单层玻璃裸浮呈现，排队期间输入卡自动隐去铬层。",
  "tags": [
    "wallpaper",
    "glass",
    "translucent"
  ],
  "accent": "#0d1627",
  "order": 999,
  "preview": {
    "light": "preview/light.jpg",
    "dark": "preview/dark.jpg"
  },
  "contributes": {
    "stylesheet": "skin.css",
    "patches": "patches.css",
    "backgroundMedia": {
      "light": {
        "type": "image",
        "src": "assets/whale-art-v2.png",
        "scrim": "linear-gradient(rgba(7, 19, 33, 0.18) 0%, rgba(7, 19, 33, 0.12) 45%, rgba(7, 19, 33, 0.22) 100%)"
      },
      "dark": {
        "type": "image",
        "src": "assets/whale-art-v2.png",
        "scrim": "linear-gradient(rgba(7, 19, 33, 0.34) 0%, rgba(7, 19, 33, 0.28) 45%, rgba(7, 19, 33, 0.38) 100%)"
      }
    }
  }
}
