{
  "$schema": "https://schemas.linxin666.org/dsh-skin/v2.json",
  "skinManifestVersion": 2,
  "id": "cyber-night",
  "name": "赛博夜城",
  "nameEn": "Cyber Night",
  "version": "0.2.0",
  "author": "logan0116",
  "tagline": "霓虹夜城背景 · 青品双色光晕 · 半透明深墨面板 · 全 token 霓虹重映射",
  "description": "《赛博夜城》— 赛博朋克夜城主题：俯视科幻都市漩涡画作铺满视口（深蓝夜空与霓虹都市、中央明亮暗角构图），遮罩随亮/暗主题实时切换并支持皮肤中心背景遮挡滑杆；青色家族替代 blue/deepseek 全部 token，品红与电紫作强调、霓虹黄作警示，深墨半透明面板让夜景透出，暗色为经典夜城调、亮色为日间霓虹变体。",
  "license": "CC0 1.0",
  "licenseUrl": "https://creativecommons.org/publicdomain/zero/1.0/",
  "attribution": "背景图由作者本人使用 OpenAI GPT 生成，作者持有输出权利并以 CC0 1.0 贡献至公有领域（background image generated by the author with OpenAI GPT, released as CC0 1.0）",
  "tags": [
    "cyberpunk",
    "neon",
    "night-city",
    "art",
    "cyan",
    "magenta",
    "translucent"
  ],
  "accent": "#00e5ff",
  "order": 100,
  "preview": {
    "light": "preview/light.png",
    "dark": "preview/dark.png"
  },
  "requires": {
    "contracts": [
      {
        "apiVersion": "x-org.linxin666.skin-center/v1alpha1",
        "kind": "SkinHooks",
        "optional": true
      }
    ]
  },
  "contributes": {
    "stylesheet": "skin.css",
    "patches": "patches.css",
    "backgroundMedia": {
      "light": {
        "type": "image",
        "src": "assets/cyber-night-art.webp",
        "scrim": "linear-gradient(rgba(244, 251, 255, 0.42) 0%, rgba(240, 249, 255, 0.52) 60%, rgba(236, 247, 255, 0.58) 100%)"
      },
      "dark": {
        "type": "image",
        "src": "assets/cyber-night-art.webp",
        "scrim": "linear-gradient(rgba(5, 8, 18, 0.20) 0%, rgba(8, 12, 26, 0.26) 60%, rgba(12, 17, 34, 0.32) 100%)"
      }
    }
  },
  "facets": {
    "client": {
      "entry": "hooks.mjs",
      "apiVersion": "x-org.linxin666.skin-center/v1alpha1"
    }
  }
}
